{"schema_version":"local-monitor-sessions.response.v1","workspace_revision":"1111111111111111111111111111111111111111111111111111111111111111","items":[{"session_id":"018f0000-0000-7000-8000-000000000001","assignment":{"state":"unassigned","authority":"none","revision":0,"repository_id":null,"candidate_repository_ids":[]},"archive":{"state":"archived","revision":1,"effectively_eligible":false,"exclusion_reason":"session_archived"},"label":{"state":"not_observed","text":null},"status":"completed","completeness":"partial","source":{"state":"recorded","values":["github-copilot-cli"]},"model":{"state":"not_observed","values":[]},"summary":{"skill":{"state":"recorded","count":0},"tool":{"state":"not_observed","count":null},"subagent":{"state":"recorded","count":0},"error":{"state":"recorded","count":0},"retry":{"state":"recorded","count":0}},"tokens":{"authority":"session_run","state":"inconsistent","available_execution_count":1,"total_execution_count":1,"input":{"state":"recorded","value":10},"output":{"state":"recorded","value":2},"total":{"state":"not_observed","value":null},"reasoning":{"state":"not_observed","value":null},"cache_read":{"state":"inconsistent","value":20},"cache_creation":{"state":"recorded","value":0},"new_input":{"state":"inconsistent","value":null},"cache_read_ratio_basis_points":{"state":"inconsistent","value":null}},"timing":{"state":"recorded","started_at":"2026-01-01T00:00:00.0000000+00:00","ended_at":"2026-01-01T00:00:01.0000000+00:00","duration_ms":1000},"capture_notes":["cache_inconsistent","token_inconsistent"],"workspace_revision":"2222222222222222222222222222222222222222222222222222222222222222"}],"next_cursor":null}