{"schema_version":"local-monitor-sessions.response.v1","workspace_revision":"3333333333333333333333333333333333333333333333333333333333333333","items":[{"session_id":"018f0000-0000-7000-8000-000000000002","assignment":{"state":"conflict","authority":"automatic","revision":2,"repository_id":null,"candidate_repository_ids":["018f0000-0000-7000-8000-000000000101","018f0000-0000-7000-8000-000000000102"]},"archive":{"state":"active","revision":0,"effectively_eligible":true,"exclusion_reason":null},"label":{"state":"recorded","text":"Synthetic session"},"status":"active","completeness":"rich","source":{"state":"recorded","values":["copilot-sdk","vscode"]},"model":{"state":"recorded","values":["model-a"]},"summary":{"skill":{"state":"recorded","count":1},"tool":{"state":"recorded","count":0},"subagent":{"state":"not_observed","count":null},"error":{"state":"recorded","count":0},"retry":{"state":"recorded","count":0}},"tokens":{"authority":"mixed","state":"recorded","available_execution_count":2,"total_execution_count":2,"input":{"state":"recorded","value":100},"output":{"state":"recorded","value":25},"total":{"state":"recorded","value":125},"reasoning":{"state":"recorded","value":5},"cache_read":{"state":"recorded","value":40},"cache_creation":{"state":"recorded","value":10},"new_input":{"state":"recorded","value":60},"cache_read_ratio_basis_points":{"state":"recorded","value":4000}},"timing":{"state":"recorded","started_at":"2026-01-02T00:00:00.0000000+00:00","ended_at":"2026-01-02T00:00:02.0000000+00:00","duration_ms":2000},"capture_notes":[],"workspace_revision":"4444444444444444444444444444444444444444444444444444444444444444"}],"next_cursor":"AXVYoWzif8i_eJFdbMK6vR8otdqPlhtWqrq26HdzcYgmAAAAAZt8AQQAMDE4ZjAwMDAtMDAwMC03MDAwLTgwMDAtMDAwMDAwMDAwMDAyj_4KJEVSuLLXsIxErLuHyhM5dtHoepCqcgQkATKBmfI"}